{
  "attester": "kinlock-testnet-attester-1",
  "category": "School",
  "city": "Nairobi",
  "country": "KE",
  "display_name": "Boundary Test School with Slug at Maximum Eighty Characters",
  "local_currency": "KES",
  "payout_address": "GCLMHF7LAR34TSELDNEREYPTNE4K7MMESPS62WXE7ZDLPWIJUF3MC5QM",
  "slug": "ke-valid-boundary-school-slug-padding-segment-test-aaaaaaaaaaaaaaaaaaaaaaaaaaaaa",
  "verified_at": "2026-10-17"
}
