{
  "attester": "kinlock-testnet-attester-1",
  "category": "School",
  "city": "Cairo",
  "country": "EG",
  "display_name": "مدرسة القاهرة النموذجية للاختبار",
  "local_currency": "EGP",
  "payout_address": "GCLMHF7LAR34TSELDNEREYPTNE4K7MMESPS62WXE7ZDLPWIJUF3MC5QM",
  "slug": "eg-test-cairo-school",
  "verified_at": "2026-10-17"
}
