{
  "attester": "kinlock-testnet-attester-1",
  "category": "School",
  "city": "Kyoto",
  "country": "JP",
  "display_name": "Kyoto Language Academy (fixture)",
  "local_currency": "JPY",
  "payout_address": "GCLMHF7LAR34TSELDNEREYPTNE4K7MMESPS62WXE7ZDLPWIJUF3MC5QM",
  "slug": "jp-test-kyoto-academy",
  "verified_at": "2026-10-17"
}
