{
  "attester": "kinlock-testnet-attester-1",
  "category": "School",
  "city": "Nairobi",
  "country": "KE",
  "display_name": "Kinlock Test School (fixture)",
  "local_currency": "KES",
  "payout_address": "GCLMHF7LAR34TSELDNEREYPTNE4K7MMESPS62WXE7ZDLPWIJUF3MC5QM",
  "slug": "ke-kinlock-test-school",
  "verified_at": "2026-10-06"
}
